condition	output_dir	official_test_chrfpp	retrieved_candidate_chrfpp	pred_vs_retrieved_chrfpp	exact_pred_equals_ref	exact_pred_equals_retrieved	retrieved_contains_pred	pred_contains_retrieved	repeat_ratio_ge_0_5	unique_preds	reading
correct_pairwise	byt5_small_pairwise_selected_same_checkpoint_controls_train512_step120_fp32_nosave	18.3574	26.6235	52.6372	0/64	0/64	17/64	1/64	4/64	58	Negative edit gate; generated output remains much closer to retrieved hint than reference.
source_only	byt5_small_pairwise_selected_same_checkpoint_controls_train512_step120_fp32_nosave	0.2729	26.6235	0.1927	0/64	0/64	0/64	0/64	59/64	64	English source alone fails almost completely under this small ByT5 gate.
retrieved_only	byt5_small_pairwise_selected_same_checkpoint_controls_train512_step120_fp32_nosave	18.6220	26.6235	55.1066	0/64	4/64	24/64	5/64	3/64	56	Retrieved Coptic alone slightly beats correct source+retrieval, proving weak source use.
wrong_shift1	byt5_small_pairwise_selected_same_checkpoint_controls_train512_step120_fp32_nosave	12.8253	17.5606	53.2999	0/64	0/64	17/64	1/64	6/64	58	Wrong retrieval hurts, so the model is retrieval-sensitive, but not source-grounded enough.
feature_selected	byt5_small_pairwise_selected_same_checkpoint_controls_train512_step120_fp32_nosave	19.1558	26.7484	56.5260	0/64	0/64	18/64	2/64	3/64	61	Best neural control, but still below candidate evidence and retrieval-dominated.
