run_id	gate_id	criterion	observed	required	status	return_to	notes
step22_full_experiment_audit_20260611	G01_score_tables_complete	all score tables have no blanks, TBD, or NA_NOT_CHECKED	bad_cells=0	bad_cells=0	PASS	22_full_experiment_audit	checked all docs/exp/second_try/**/score_table.tsv
step22_full_experiment_audit_20260611	G02_file_results_current	all file_results paths exist and file bytes/md5 match	file_result_bad=0	file_result_bad=0	PASS	22_full_experiment_audit	directories are existence-checked; files are hash-checked
step22_full_experiment_audit_20260611	G03_no_final_access	v2 audit rows do not access ACT final	no_final_rows=46; no_final_bad=0	final_access=NO for every row	PASS	12_v2_split_protocol	Steps 13-27 report train/MAR-dev or docs-only access
step22_full_experiment_audit_20260611	G04_script_final_path_search	Steps 13-27 scripts and synthesis outputs do not read ACT final data	path-read hits=0; hits are only NO_ACT_FINAL_ACCESS notes	no ACT/final-test input path read	PASS	22_full_experiment_audit	grep found only guardrail strings and comments/results text
step22_full_experiment_audit_20260611	G05_v1_shortcut_status	v1 shortcut risks are not used as active evidence	Step07 and Branch001 translation successes invalidated by Step09/10	no invalidated run used for final claim	PASS_INVALIDATED	09_top_tier_validation;10_leakage_selection_audit	v1 translation evidence remains exploratory only
step22_full_experiment_audit_20260611	G06_v2_positive_model_claim	current v2 evidence allows positive adapted-model claim	NO; Step15/16/18/19/20/21/24/25 gates fail, Step23 is only a redesign probe pass, and Steps26/27 block positive wording/package	positive claim requires passing MLM/control/repair gates	PASS_BLOCKED_POSITIVE_CLAIM	14_v2_embedding_init or tokenizer_objective_redesign	audit succeeds by blocking unsupported claim
step22_full_experiment_audit_20260611	G07_next_experiments_required	additional experiments are defined before positive claim	YES; next_experiments.tsv written	P0 experiments listed with gates and return steps	PASS	22_full_experiment_audit	negative/diagnostic synthesis is allowed only after removing unsupported positive claims
